X;ID;Codigo;Alternativo;EAN;Stock;Descripcion;Marca;Categoria;Division;Precio;
etl.bascs.impala.clases.Producto@1fd6a34;136;GC-633-01NV;G1723;7841175009541;50;CALENTADOR RECTANGULAR TOKYO IND MOD 633-01-9 LTS DIMENSION 600*350*320;TOKYO INDUSTRIAL;MANTENEDORAS DE ALIMENTO;GASTRONOMIA Y EQUIPOS COMERCIALES;287.000;
etl.bascs.impala.clases.Producto@807b05;137;GC-834-01NV;G1726;7841175009558;20;CALENTADOR RECTANGULAR TOKYO IND MOD 834-01 INOX 4 LTS DIMENSION 430*295*320;TOKYO INDUSTRIAL;MANTENEDORAS DE ALIMENTO;GASTRONOMIA Y EQUIPOS COMERCIALES;271.600;
etl.bascs.impala.clases.Producto@10591d1;138;GCR-K900DP;G2074;6932398819275;50;CALENTADOR RECTANGULAR TOKYO IND MOD K900DP INOX 9 LTS TAPA BASCULANTE DIMENSION;TOKYO INDUSTRIAL;MANTENEDORAS DE ALIMENTO;GASTRONOMIA Y EQUIPOS COMERCIALES;786.175;
etl.bascs.impala.clases.Producto@3fdfcb;139;GCR-S901;G2073;6932398819282;50;CALENTADOR RECTANGULAR TOKYO IND MOD S901 INOX 9 LTS TAPA BASCULANTE DIMENSION 7;TOKYO INDUSTRIAL;MANTENEDORAS DE ALIMENTO;GASTRONOMIA Y EQUIPOS COMERCIALES;938.900;
etl.bascs.impala.clases.Producto@29b6b2;140;GC-835NV;G1724;7841175009602;50;CALENTADOR REDONDO TOKYO IND MOD 835 INOX 5.5 LTS DIMENSION 550*315*290;TOKYO INDUSTRIAL;MANTENEDORAS DE ALIMENTO;GASTRONOMIA Y EQUIPOS COMERCIALES;287.000;
etl.bascs.impala.clases.Producto@1d8a521;141;GC-836NV;G1722;7841175009565;50;CALENTADORA OVAL TOKYO IND MOD 836 INOX 5.5 LTS DIMENSION 550*315*290;TOKYO INDUSTRIAL;MANTENEDORAS DE ALIMENTO;GASTRONOMIA Y EQUIPOS COMERCIALES;296.840;
etl.bascs.impala.clases.Producto@443a12;142;GIMEVO1500;GI77;7841175016754;50;CAMINADORA EVOLUTION EVO1500 130KG 220V/50Hz;EVOLUTION;CAMINADORAS;FITNESS;3.900.003;
etl.bascs.impala.clases.Producto@77356;143;GIMEVO4000PR;GI78;7841175016761;5;CAMINADORA EVOLUTION EVO4000PRO 150 KG 220V/50Hz;EVOLUTION;CAMINADORAS;FITNESS;8.900.012;
etl.bascs.impala.clases.Producto@110d682;144;GIMEVO800-N;GI76;7841175014668;50;CAMINADORA EVOLUTION FITNESS EVO800 110KG;EVOLUTION;CAMINADORAS;FITNESS;3.286.484;
etl.bascs.impala.clases.Producto@14b842c;145;GIMEVO06-N;GI18;;50;CAMINADORES EVOLUTION FITNESS EVO06 100KGS MAX PANTALLA LCD;EVOLUTION;CAMINADORAS;FITNESS;2.499.971;
etl.bascs.impala.clases.Producto@86a1fd;146;GIMEVO201-N;GI63;7841175007196;50;CAMINADORES EVOLUTION FITNESS EVO201 110KG;EVOLUTION;CAMINADORAS;FITNESS;3.995.009;
etl.bascs.impala.clases.Producto@1daef38;147;EDARAHBS9.3FLLX;AR18;8050147557907;20;CAMPANA ARISTON AHBS9.3FLLX 90CM INOX 4VEL;ARISTON;CAMPANAS EXTRACTORAS DE COCINA;VENTILACION;3.492.576;
etl.bascs.impala.clases.Producto@898507;148;EDARAHBS9.7FLTIX;AR19;8007842950540;20;CAMPANA ARISTON AHBS9.7FLTIX 90CM INOX 3VEL TOUCH;ARISTON;CAMPANAS EXTRACTORAS DE COCINA;VENTILACION;3.684.598;
etl.bascs.impala.clases.Producto@1641d5e;149;EDTCSITA4H;T1404;7898232180057;50;CAMPANA DE COCINA INOX TOKYO SITA 4HORNALLAS VIDRIO CURVO 60CM 220V;TOKYO;CAMPANAS EXTRACTORAS DE COCINA;VENTILACION;1.161.512;
etl.bascs.impala.clases.Producto@5adb86;150;EDTCSITA6H;T1405;7898232184512;50;CAMPANA DE COCINA INOX TOKYO SITA 6HORNALLAS VIDRIO CURVO 90CM 220V;TOKYO;CAMPANAS EXTRACTORAS DE COCINA;VENTILACION;1.592.121;
etl.bascs.impala.clases.Producto@6d471a;151;EDTKCNEA4H;T2607;7841175015115;50;CAMPANA PIRAMIDAL TOKYO INOX NEA 4H 60CM 1000 M3/H FILTRO/C;TOKYO;CAMPANAS EXTRACTORAS DE COCINA;VENTILACION;934.985;
etl.bascs.impala.clases.Producto@3459ad;152;EDTKCNEA6H;T2608;7841175015122;50;CAMPANA PIRAMIDAL TOKYO INOX NEA 6H 90CM 1000 M3/H FILTRO/C;TOKYO;CAMPANAS EXTRACTORAS DE COCINA;VENTILACION;1.090.023;
etl.bascs.impala.clases.Producto@1a92718;153;EDWCWAI96AR;W348;7797750006347;50;CAMPANA WHIRLPOOL DECORATIVE WAI96AR 90CM VIDRIO CURVO;WHIRLPOOL;CAMPANAS EXTRACTORAS DE COCINA;VENTILACION;3.980.537;
etl.bascs.impala.clases.Producto@17d5500;154;AALG-CMCHW0;LG24;8851434625503;20;CARCASA P/ EVAPORADOR LG CASSETE INVERTER DE 24000 A 60000BTU/H MOD PT-MCHW0;LG;ACCESORIOS CLIMATIZACION;CLIMATIZACION;1.177.994;
etl.bascs.impala.clases.Producto@15282a2;155;GCT-RPCL3;G1166;6932398815635;20;CARRO DE 3NIVELES TOKYO INDUSTRIAL RPC-L3 P/SERVICIO C/RUEDAS;TOKYO INDUSTRIAL;CARROS GASTRONOMICOS;GASTRONOMIA Y EQUIPOS COMERCIALES;825.000;
etl.bascs.impala.clases.Producto@1e15054;156;GC-TRM18A;G1126;6932398812221;5;CARRO P/18 BANDEJAS TOKYO INDUSTRIAL 1/1 INOX-TR-M18A;TOKYO INDUSTRIAL;CARROS GASTRONOMICOS;GASTRONOMIA Y EQUIPOS COMERCIALES;1.180.000;
etl.bascs.impala.clases.Producto@1c23597;157;ELELGK71;LG31;8806087049558;20;CELULAR LG K71 PANTALLA  6.8'' FHD+ 128GB 4GB RAM QUAD CAM 3+1 BAT 4000MAH;LG;TELEFONOS CELULARES;TV/AUDIO/VIDEO;2.499.971;
etl.bascs.impala.clases.Producto@54b0ba;158;ELEMI11LITE128G;X18;6934177732874;20;CELULAR XIAOMI MI 11 LITE PANTALLA 6.55 FHD+ 128GB ROM 6GB RAM TRIP CAM BATERIA;XIAOMI;TELEFONOS CELULARES;TV/AUDIO/VIDEO;3.150.005;
etl.bascs.impala.clases.Producto@1546880;159;ELEPOCOX3SG;X25;6941059650447;20;CELULAR XIAOMI POCO X3 PRO BLACK PANTALLA 6.67 FHD+ 128GB ROM 6GB RAM QUAD CAM B;XIAOMI;TELEFONOS CELULARES;TV/AUDIO/VIDEO;2.700.033;
etl.bascs.impala.clases.Producto@a4fece;160;ELEPOCOX3PROAZ;X26;6934177738302;50;CELULAR XIAOMI POCO X3 PRO BLUE PANTALLA 6.67 FHD+ 128GB ROM 6GB RAM QUAD CAM BA;XIAOMI;TELEFONOS CELULARES;TV/AUDIO/VIDEO;2.700.033;
etl.bascs.impala.clases.Producto@f00a40;161;ELEZTEA31;Z1;6902176054075;50;CELULAR ZTE BLADE A31 LITE GRIS PANTALLA 5 FWVGA+ 32GB ROM 1GB RAM SINGLE CAM BA;ZTE;TELEFONOS CELULARES;TV/AUDIO/VIDEO;584.977;
etl.bascs.impala.clases.Producto@1ecab44;162;ELEZTEA51;Z2;6902176060823;50;CELULAR ZTE BLADE A51 GRIS PANTALLA 6.52 HD+ 32GB ROM 2GB RAM DUAL CAM BATERIA 3;ZTE;TELEFONOS CELULARES;TV/AUDIO/VIDEO;949.993;
etl.bascs.impala.clases.Producto@170dad1;163;ELEZTEA71;Z3;6902176057021;50;CELULAR ZTE BLADE A71 GRIS PANTALLA 6.52 HD+ 64GB ROM 3GB RAM TRIPLE CAM BATERIA;ZTE;TELEFONOS CELULARES;TV/AUDIO/VIDEO;1.199.970;
etl.bascs.impala.clases.Producto@b91e7f;164;EDASCRA55;A488;7797003956399;50;CENTRIFUGA DE ROPAS ARNO MOD CRA55 5.2KGS BLANCA TAMBOR INOX;ARNO;CENTRIFUGAS DE ROPA -10KG;LAVADO/SECADO;707.252;
etl.bascs.impala.clases.Producto@1dbda2;165;EDTMCE15BL;T2670;7908312805692;50;CENTRIFUGA DE ROPAS TOKYO 15BL CAP 15KGS BLANCA 1800 RPM 180W;TOKYO;CENTRIFUGAS DE ROPA +10KG;LAVADO/SECADO;614.993;
etl.bascs.impala.clases.Producto@858b2e;166;EDTCECOMP15;T2678;7841175015764;50;CENTRIFUGA TOKYO 15KG COMPACT15  1560RPM TAMBOR DE ACERO;TOKYO;CENTRIFUGAS DE ROPA +10KG;LAVADO/SECADO;500.021;
etl.bascs.impala.clases.Producto@162713d;167;EDTOKCEN55IN;T1972;7841175009336;50;CENTRIFUGADORA TOKYO INOX 5.5KG TOKCEN55IN;TOKYO;CENTRIFUGAS DE ROPA -10KG;LAVADO/SECADO;657.672;
etl.bascs.impala.clases.Producto@1bcdb08;168;GCPMH-CGB1C;G2084;;5;CHOPPERA MEMO 1 CANILLA MOD BARRIL A HIELO 30L X HORA 23KG HIELO;MEMO;CHOPERAS;GASTRONOMIA Y EQUIPOS COMERCIALES;2.655.000;
etl.bascs.impala.clases.Producto@fb9230;169;GCPMH-ICF1C;G2085;7898923191409;5;CHOPPERA MEMO 1 CANILLA MOD ICEFORT A HIELO 30L X HORA 28KG HIELO;MEMO;CHOPERAS;GASTRONOMIA Y EQUIPOS COMERCIALES;2.193.500;
etl.bascs.impala.clases.Producto@7fb73a;170;GCPMH-ICF2C;G2086;7898923191423;0;CHOPPERA MEMO 2 CANILLAS MOD ICEFORT A HIELO 60L X HORA 28KG HIELO;MEMO;CHOPERAS;GASTRONOMIA Y EQUIPOS COMERCIALES;3.192.875;
etl.bascs.impala.clases.Producto@b2cc51;171;EDTCHFLEX360-N;T2421;7841175013012;50;CHURRASQUERA PLANCHA GRILL TOKYO FLEXI 360 2000W 220V 50HZ;TOKYO;SANDWICHERAS;PEQUEÑOS ELECTRODOMESTICOS;306.994;
etl.bascs.impala.clases.Producto@1913ed4;172;GCLS-CLM400;G2127;7895707672017;0;CILINDRO LAMINADOR DE MESA INOX SKYMSEN ROLLOS DE 400MM MASA DE 5KG 1HP 220V50HZ;SKYMSEN;EQUIPOS DE PANADERIA;GASTRONOMIA Y EQUIPOS COMERCIALES;12.100.125;
etl.bascs.impala.clases.Producto@1314304;173;COTOAP-RE;T1450;7899639731811;50;COCINA A GAS TOKYO APOLO C/RESPALDO 4H MESA INOX;TOKYO;COCINAS A GAS;COCCION;357.981;
etl.bascs.impala.clases.Producto@44feff;174;COTOBRA4HECP-RE;T1995;7899639731774;50;COCINA A GAS TOKYO BRAVO CON ENCENDIDO 4H CALIENTA PLATOS MESA INOX CON LUZ;TOKYO;COCINAS A GAS;COCCION;890.028;
etl.bascs.impala.clases.Producto@6a6022;175;COTODA5-RE;T1723;7899639716146;20;COCINA A GAS TOKYO DALLAS 5H MESA ACERO INOX;TOKYO;COCINAS A GAS;COCCION;1.149.988;
etl.bascs.impala.clases.Producto@ab8c65;176;COTODA4HL-RE;T2547;7899639790900;50;COCINA A GAS TOKYO DALLAS BLANCO 4H MESA INOX TAPA DE VIDRIO HORNO LIMPIA FACIL;TOKYO;COCINAS A GAS;COCCION;690.033;
etl.bascs.impala.clases.Producto@1edc7d7;177;COTODA4HLN-RE;T2548;7899639799897;50;COCINA A GAS TOKYO DALLAS NEGRO 4H MESA INOX TAPA DE VIDRIO HORNO LIMPIA FACIL;TOKYO;COCINAS A GAS;COCCION;679.983;
etl.bascs.impala.clases.Producto@2f7e13;178;COTOEU4HITE-RE;T1997;7899639731798;50;COCINA A GAS TOKYO EURO 4H FRENTE INOX TOP CONTROL ENCENDIDO. LUZ Y PARRILLA AUT;TOKYO;COCINAS A GAS;COCCION;1.532.558;
etl.bascs.impala.clases.Producto@1bf6744;179;COTONPET4H;T2738;7899639701784;50;COCINA A GAS TOKYO NEW PETIT 4H MESADA INOX HORNO LIMPIA FACIL CON ZOCALO;TOKYO;COCINAS A GAS;COCCION;741.020;
etl.bascs.impala.clases.Producto@12516f2;180;COTOEU4HHEN-RE;T2056;7899639731873;50;COCINA COMBINADA TOKYO EURO 4H A GAS NEG HORNO ELECTRICO CON ENCENDIDO MESA INOX;TOKYO;COCINAS COMBINADAS;COCCION;1.345.293;
etl.bascs.impala.clases.Producto@f9ad7e;181;COVO96EACP;V30;7797039901394;20;COCINA COMBINADA VOLCAN HORNALLAS A GAS/HORNO ELECTRICO-MOD 96EACP;VOLCAN;COCINAS COMBINADAS;COCCION;4.699.983;
etl.bascs.impala.clases.Producto@14d8254;182;COTOKDUALII-N;T2452;7841175013234;50;COCINA ELECT TOKYO MD TOKDUALII 2HORN 1 INDUCC 1 INFRARROJO;TOKYO;ANAFES DE EMPOTRAR;COCCION;620.018;
etl.bascs.impala.clases.Producto@1d85bfe;183;COTOK19-N;T882;7841175001347;50;COCINA ELECTRICA TOKYO 1PLACA MOD TOK19 1500W;TOKYO;ANAFES DE MESA / PLACAS;COCCION;150.013;
etl.bascs.impala.clases.Producto@db5631;184;COTOK20-N;T881;7841175001354;50;COCINA ELECTRICA TOKYO 2PLACAS MOD TOK20 1500-750W;TOKYO;ANAFES DE MESA / PLACAS;COCCION;239.994;
etl.bascs.impala.clases.Producto@1329289;185;EDARCA6V530(X)EX;AR20;8007842837964;5;COCINA ELÉCTRICA ARISTON A6V530(X)EX 4H VITRO INOX;ARISTON;COCINAS ELECTRICAS;COCCION;5.459.160;
etl.bascs.impala.clases.Producto@dceb19;186;GCP-PM200;G1209;7898466530802;20;COCINA PROGAS 2HORNALLAS MOD PM-200;PROGAS;COCINAS COMERCIALES;GASTRONOMIA Y EQUIPOS COMERCIALES;950.000;
etl.bascs.impala.clases.Producto@1d45597;187;GCOPG-PMS400;G838;7898466530826;20;COCINA PROGAS MOD PMS-400 4H 30*30CM SIN HORNO;PROGAS;COCINAS COMERCIALES;GASTRONOMIA Y EQUIPOS COMERCIALES;1.750.000;
etl.bascs.impala.clases.Producto@138f242;188;COVO85852P;V29;7797039002909;20;COCINA VOLCAN MOD 85852P ACERO INOXIDABLE;VOLCAN;COCINAS A GAS;COCCION;3.749.990;
etl.bascs.impala.clases.Producto@2d8df6;189;COWFD5NARRUW;W453;7891129519909;50;COCINA WHIRLPOOL WFD5NARRUW 5H INOX DOBLE HORNO;WHIRLPOOL;COCINAS A GAS;COCCION;4.680.017;
etl.bascs.impala.clases.Producto@1d83f49;190;EDRC95095099-N;R233;074590544442;50;COMBO REMINGTON SECADOR AC5099 Y ALISADOR S9509 ULTIMATE CERAMIC + ADAPTADOR;REMINGTON;COMBOS;CUIDADO PERSONAL;780.014;
etl.bascs.impala.clases.Producto@9bb188;191;CGTCON4002TCV;T1707;7841175004195;50;CONGEL. HORIZ. TOKYO TCON4002TCV DOB TAP/CIEGA+VIDRIO DESLIZ.;TOKYO;CONGELADORES HORIZONTALES;REFRIGERACION;4.600.019;
etl.bascs.impala.clases.Producto@e9e5fb;192;CGGAFL290B;GAF3;7791758119207;50;CONGELADOR GAFA HORIZONTAL ETERNITY L290B 1 TAPA 285LTS;GAFA;CONGELADORES HORIZONTALES;REFRIGERACION;2.999.992;
etl.bascs.impala.clases.Producto@6b9ded;193;CGGAFM210B;GAF1;7791758119108;50;CONGELADOR GAFA HORIZONTAL ETERNITY M210B 1 TAPA BLANCO 205 lts;GAFA;CONGELADORES HORIZONTALES;REFRIGERACION;2.700.033;
etl.bascs.impala.clases.Producto@55d71e;194;CGGAFXL410BDP;GAF2;7791758119405;50;CONGELADOR GAFA HORIZONTAL ETERNITY XL410BDP 2 TAPAS 399LTS;GAFA;CONGELADORES HORIZONTALES;REFRIGERACION;3.860.004;
etl.bascs.impala.clases.Producto@1792d2d;195;CGTCONP400;T1329;7841175004201;50;CONGELADOR P/HELADOS TOKYO MOD TCONP400 333 NET 2T/VID. DESLIZ.;TOKYO;CONGELADORES HORIZONTALES;REFRIGERACION;4.549.970;
etl.bascs.impala.clases.Producto@cecdc4;196;CGTCONH220R;T1859;7841175008261;50;CONGELADOR P/HELADOS TOKYO TCONH220R 132 NET VID.CURVO DESLIZ.;TOKYO;CONGELADORES HORIZONTALES;REFRIGERACION;2.980.026;
etl.bascs.impala.clases.Producto@e8a9c5;197;CGTCONH350R;T1860;7841175008278;50;CONGELADOR P/HELADOS TOKYO TCONH350R 263 NET 2T/VID.CURVO DESLIZ.;TOKYO;CONGELADORES HORIZONTALES;REFRIGERACION;4.400.024;
etl.bascs.impala.clases.Producto@4962a1;198;CGTCONP500;T1330;7841175004218;50;CONGELADOR PARA HELADOS TOKYO MOD TCONP500 415 NET 2TAPAS VIDRIO DESLIZ;TOKYO;CONGELADORES HORIZONTALES;REFRIGERACION;4.790.500;
etl.bascs.impala.clases.Producto@493f00;199;CGTCON240HC;T2613;7899461860055;50;CONGELADOR TOKYO MOD TCON240HC  1 TAPA CIEGA FUNCION DUAL C/RUEDAS PROTECCIÓN EP;TOKYO;CONGELADORES HORIZONTALES;REFRIGERACION;2.900.028;
etl.bascs.impala.clases.Producto@3778e0;200;CGTCON350DF;T2391;7841175012855;50;CONGELADOR TOKYO MOD TCON350DF 290 NET T/ CIEGA+VIDRIO DESLIZ;TOKYO;CONGELADORES HORIZONTALES;REFRIGERACION;3.310.001;
etl.bascs.impala.clases.Producto@1de4ea2;201;CGTCON540HC;T2616;7899461825498;50;CONGELADOR TOKYO MOD TCON540HC  2 TAPA CIEGA  FUNCION DUAL C/RUEDAS PROTECCIÓN E;TOKYO;CONGELADORES HORIZONTALES;REFRIGERACION;4.750.032;
etl.bascs.impala.clases.Producto@8f6092;202;CGTCON160DF;T2352;7841175012343;50;CONGELADOR TOKYO TCON160DF 143 NET 2FUNC+TAPA CIEGA+LUZ LED+INT BLA;TOKYO;CONGELADORES HORIZONTALES;REFRIGERACION;1.819.988;
etl.bascs.impala.clases.Producto@121f7fc;203;CGTCON520DF;T2354;7841175012367;50;CONGELADOR TOKYO TCON520DF 512 NET 2 T/CIEGA;TOKYO;CONGELADORES HORIZONTALES;REFRIGERACION;4.699.983;
etl.bascs.impala.clases.Producto@e265c0;204;CGTOK157L;T2392;7841175012862;20;CONGELADOR TOKYO VERTICAL FRIO HUMEDO 5 CAJONES NETO 157 LTS 220V;TOKYO;CONGELADORES VERTICALES;REFRIGERACION;2.600.002;
etl.bascs.impala.clases.Producto@17c8ce0;205;CGWVG28HKDWX;W449;7891129253407;50;CONGELADOR VERTICAL WHIRLPOOL WVG28HK 280L EVOX FRIO SECO;WHIRLPOOL;CONGELADORES VERTICALES;REFRIGERACION;4.252.356;
etl.bascs.impala.clases.Producto@46eded;206;EDPCLF600G;TR169;7899812225595;50;CORTACESPED TRAPP LF-600G NAFTERO 6.5HP S/ BOLSA;TRAPP;CORTADORAS DE CESPED;JARDIN;2.515.113;
etl.bascs.impala.clases.Producto@2684e;207;EDPCLF80G;TR167;7899812225601;50;CORTACESPED TRAPP LF-80G NAFTERO 3.5HP S/ BOLSA;TRAPP;CORTADORAS DE CESPED;JARDIN;2.185.607;
etl.bascs.impala.clases.Producto@13bd6eb;208;EDPC50E;TR11;7896260200273;50;CORTACESPED TRAPP MC-50E ELECTRICO 2500W S/ BOLSA;TRAPP;CORTADORAS DE CESPED;JARDIN;2.199.677;
etl.bascs.impala.clases.Producto@174820;209;EDPC1HP;TR3;7896260201614;50;CORTACESPED TRAPP MC40L ELECTRICO 1300W C/ BOLSA;TRAPP;CORTADORAS DE CESPED;JARDIN;1.729.538;
etl.bascs.impala.clases.Producto@16beb0a;210;EDPCSL30S1050;TR118;7896260206701;50;CORTACESPED TRAPP SL30S ELECTRICO 1050W S/ BOLSA;TRAPP;CORTADORAS DE CESPED;JARDIN;1.178.128;
etl.bascs.impala.clases.Producto@80b6b1;211;EDPWM350;TR98;7896260209092;50;CORTACESPED TRAPP WM350 ELECTRICO 1300W C/ RECOLECTOR;TRAPP;CORTADORAS DE CESPED;JARDIN;1.253.570;
etl.bascs.impala.clases.Producto@19fa444;212;GCFS-CA300L;G1942;7895707641860;0;CORTADORA DE FIAMBRES SKYMSEN INOX MOD CA-300L CUCHILLA 300mm 1.4 HP 220V/50HZ;SKYMSEN;CORTADORAS COMERCIALES;GASTRONOMIA Y EQUIPOS COMERCIALES;16.350.000;
etl.bascs.impala.clases.Producto@109b8df;213;EDRCHC5850;R151;074590530926;50;CORTAPELO REMINGTON MOD HC5850 IRROMPIBLE 220V-50HZ;REMINGTON;CORTAPELOS;CUIDADO PERSONAL;384.982;
etl.bascs.impala.clases.Producto@14a2a8f;214;EDRCHC06A;R249;074590552546;50;CORTAPELOS REMINGTON MOD HC06A 23 PIEZAS CUCHILLAS ACERO QUIRURGICO;REMINGTON;CORTAPELOS;CUIDADO PERSONAL;180.029;
etl.bascs.impala.clases.Producto@fe35e9;215;EDTCA10Y2S;T2383;7841175012817;20;CORTINA DE AIRE TOKYO C/CONTROL MOD FM3010-Y-2-S 1 M;TOKYO;CORTINAS DE AIRE DE FLUJO CRUZADO;VENTILACION;837.031;
etl.bascs.impala.clases.Producto@a908f6;216;EDTCA12Y2S;T896;7841175003532;20;CORTINA DE AIRE TOKYO C/CONTROL MOD FM3012-Y-2-S 1.2M;TOKYO;CORTINAS DE AIRE DE FLUJO CRUZADO;VENTILACION;1.090.023;
etl.bascs.impala.clases.Producto@fc9efc;217;EDTCA15Y2S;T897;7841175003549;20;CORTINA DE AIRE TOKYO C/CONTROL MOD FM3015-Y-2-S 1.5M;TOKYO;CORTINAS DE AIRE DE FLUJO CRUZADO;VENTILACION;1.317.019;
etl.bascs.impala.clases.Producto@14d8fe;218;EDTCA20Y2S;T2384;7841175012824;20;CORTINA DE AIRE TOKYO C/CONTROL MOD FM3020-Y-2-S 2 M;TOKYO;CORTINAS DE AIRE DE FLUJO CRUZADO;VENTILACION;1.920.019;
etl.bascs.impala.clases.Producto@192e068;219;UTGI1102000-N;IMU50;7702073110206;50;CUCHARON AD IMUSA NG ESE MOD 1102000;IMUSA;ACCESORIOS DE GASTRONOMIA;GASTRONOMIA Y EQUIPOS COMERCIALES;11.524;
etl.bascs.impala.clases.Producto@1f8b8d4;220;UTGI1102100-N;IMU51;7702073110213;50;CUCHARON AD IMUSA NG ESE MOD 1102100;IMUSA;ACCESORIOS DE GASTRONOMIA;GASTRONOMIA Y EQUIPOS COMERCIALES;14.003;
etl.bascs.impala.clases.Producto@141d329;221;GCBCRC-CK;G1962;;0;CUTTER BATIDORA CALENTADORA ROBOT COUPE MOD COOK 230/50-60/1;ROBOT COUPE;CORTADORAS COMERCIALES;GASTRONOMIA Y EQUIPOS COMERCIALES;23.677.500;
etl.bascs.impala.clases.Producto@19420d7;222;GCHRC-CL50E;G1965;;0;CUTTER CORTA HORTALIZAS ROBOT COUPE MOD CL50E 220/50/1;ROBOT COUPE;CORTADORAS COMERCIALES;GASTRONOMIA Y EQUIPOS COMERCIALES;12.771.500;
etl.bascs.impala.clases.Producto@1e519ed;223;GCHRC-R201XL;G1963;;5;CUTTER CORTA HORTALIZAS ROBOT COUPE MOD R201XL 550W 220/50HZ;ROBOT COUPE;REBANADORES COMERCIALES;GASTRONOMIA Y EQUIPOS COMERCIALES;7.984.750;
etl.bascs.impala.clases.Producto@1ed2bdd;224;GCPMRC-R3D;G1968;;0;CUTTER PICADORA DE MESA ROBOT COUPE MOD R3D 1500T 230/50/1;ROBOT COUPE;REBANADORES COMERCIALES;GASTRONOMIA Y EQUIPOS COMERCIALES;11.172.500;
etl.bascs.impala.clases.Producto@7a7a52;225;GD8103-N;G1375;6932398819398;20;DISPENSADOR DE PAPEL HIGIENICO TOKYO INDUSTRIAL MOD 810-3;TOKYO INDUSTRIAL;ACCESORIOS DE GASTRONOMIA;GASTRONOMIA Y EQUIPOS COMERCIALES;67.068;
etl.bascs.impala.clases.Producto@e6bd2;226;GEMT-EL10;G217;7899511914974;20;EMBUTIDORA DE CHORIZO METVISA 10 KG- EL-10;METVISA;REBANADORES COMERCIALES;GASTRONOMIA Y EQUIPOS COMERCIALES;2.395.000;
etl.bascs.impala.clases.Producto@1ab374f;227;EDTCSFOGO;T2536;;50;ENCENDEDOR DE CARBON TOKYO PARA COCINA DE USO DOMESTICO;TOKYO;ENCENDEDOR ELECTRICO;COCCION;79.998;
etl.bascs.impala.clases.Producto@1e051a4;228;EEVSYM-HCSI;SY5;8901791100561;50;ENFRIADOR EVAPORATIVO SYMPHONY NEW HI-COOL SMART-I C/CONTROL REMOTO;SYMPHONY;ENFRIADORES EVAPORATIVOS;CLIMATIZACION;930.027;
etl.bascs.impala.clases.Producto@451ae0;229;UTGI1102200-N;IMU52;7702073110220;50;ESPUMADERA AD IMUSA NG ESE MOD 1102200;IMUSA;ACCESORIOS DE GASTRONOMIA;GASTRONOMIA Y EQUIPOS COMERCIALES;11.993;
etl.bascs.impala.clases.Producto@15eb981;230;GETE-EO6;G1959;7893484003536;5;EXHIBIDOR TERMICO EDANCA MOD E0-6 6 BANDEJAS SIMPLES;EDANCA;EXHIBIDORAS DE ALIMENTO;GASTRONOMIA Y EQUIPOS COMERCIALES;930.000;
etl.bascs.impala.clases.Producto@1a1e6aa;231;GETE-EOD10;G1960;7893484003543;0;EXHIBIDOR TERMICO EDANCA MOD E0D-10 10 BANDEJAS DUPLA;EDANCA;EXHIBIDORAS DE ALIMENTO;GASTRONOMIA Y EQUIPOS COMERCIALES;1.350.000;
etl.bascs.impala.clases.Producto@81e68b;232;GET-EO4;G1826;7893484003086;20;EXHIBIDOR TERMICO MOD EO4 CURVA PRATA 4B 220V 50 HZ EDANCA;EDANCA;EXHIBIDORAS DE ALIMENTO;GASTRONOMIA Y EQUIPOS COMERCIALES;736.500;
etl.bascs.impala.clases.Producto@797b21;233;GET-EO5;G1827;7893484002850;20;EXHIBIDOR TERMICO MOD EO5 CURVA PRATA 5B 220V 50 HZ EDANCA;EDANCA;EXHIBIDORAS DE ALIMENTO;GASTRONOMIA Y EQUIPOS COMERCIALES;866.500;
etl.bascs.impala.clases.Producto@17401e;234;GET-EOD6;G1828;;20;EXHIBIDOR TERMICO MOD EOD6 CURVA PRATA DUPLA 6B 220V 50 HZ EDANCA;EDANCA;EXHIBIDORAS DE ALIMENTO;GASTRONOMIA Y EQUIPOS COMERCIALES;1.050.000;
etl.bascs.impala.clases.Producto@6b6580;235;GET-EOD8;G1829;7893484002935;5;EXHIBIDOR TERMICO MOD EOD8 CURVA PRATA DUPLA 8B 220V 50 HZ EDANCA;EDANCA;EXHIBIDORAS DE ALIMENTO;GASTRONOMIA Y EQUIPOS COMERCIALES;1.190.000;
etl.bascs.impala.clases.Producto@17b7438;236;GE-LRWS809D;G1022;6932398814522;20;EXHIBIDOR TERMICO TOKYO IND DE MESA 2.3KW 30N 80N C LR-WS-809D;TOKYO INDUSTRIAL;EXHIBIDORAS DE ALIMENTO;GASTRONOMIA Y EQUIPOS COMERCIALES;2.960.000;
etl.bascs.impala.clases.Producto@d0a945;237;GET-LRWS1000;G1350;6932398814553;20;EXPOSITOR TERMICO TOKYO INDUSTRIAL MD LR-WS-1000 TEMP 60N-85NC 1.02X0.95X1.92MTS;TOKYO INDUSTRIAL;EXHIBIDORAS DE ALIMENTO;GASTRONOMIA Y EQUIPOS COMERCIALES;25.500.000;
etl.bascs.impala.clases.Producto@4101b1;238;CGTOKFVS431C;T2626;7899461805582;20;EXPOSITOR VERTICAL TOKYO  MOD TOKFVS450C PANEL LED;TOKYO;VISICOOLERS PARA BEBIDAS;REFRIGERACION;6.500.005;
etl.bascs.impala.clases.Producto@1893cdc;239;CGTOKFVS501C;T2627;7899461826457;50;EXPOSITOR VERTICAL TOKYO  MOD TTOKFVS520C;TOKYO;VISICOOLERS PARA BEBIDAS;REFRIGERACION;6.899.995;
etl.bascs.impala.clases.Producto@1f95c21;240;CGTOKVS250D;T2348;7841175012268;50;EXPOSITOR VERTICAL TOKYO-MOD TOKVS250 PANEL LED 250L COM/242L NETO;TOKYO;VISICOOLERS PARA BEBIDAS;REFRIGERACION;5.599.994;
etl.bascs.impala.clases.Producto@9c5cda;241;CGTOKFVS284;T2624;7899461852944;50;EXPOSITOR VERTICAL TOKYO-MOD TOKVS300 PANEL LED;TOKYO;VISICOOLERS PARA BEBIDAS;REFRIGERACION;4.990.026;
etl.bascs.impala.clases.Producto@249d31;242;CGTOKVS350D;T2349;7841175012312;50;EXPOSITOR VERTICAL TOKYO-MOD TOKVS350 PANEL LED 350L COM/330L NETO;TOKYO;VISICOOLERS PARA BEBIDAS;REFRIGERACION;6.599.969;
etl.bascs.impala.clases.Producto@713475;243;CGTOKFVS402;T2625;7899461835985;50;EXPOSITOR VERTICAL TOKYO-MOD TOKVS402 PANEL LED;TOKYO;VISICOOLERS PARA BEBIDAS;REFRIGERACION;5.599.994;
etl.bascs.impala.clases.Producto@17a650e;244;EDAECP32;A511;3016661158094;20;EXPRIMIDOR ARNO MOD CP32 ROJO 0.75L 40W POWER;ARNO;JUGUERAS;PEQUEÑOS ELECTRODOMESTICOS;209.978;
etl.bascs.impala.clases.Producto@1c48c37;245;EDXEPC30-N;MX102;3045386373543;50;EXPRIMIDOR MOULINEX PC30 VITAPRESS 600ML;MOULINEX;JUGUERAS;PEQUEÑOS ELECTRODOMESTICOS;210.313;
etl.bascs.impala.clases.Producto@1ff53eb;246;EDTMEPREMIUM;T2662;7841175015474;50;EXPRIMIDOR TOKYO PREMIUM JARRA 1,25 ML 2 CONOS;TOKYO;JUGUERAS;PEQUEÑOS ELECTRODOMESTICOS;150.013;
etl.bascs.impala.clases.Producto@4c043d;247;EDTETURBOP;T2708;7841175016235;50;EXPRIMIDOR TOKYO TURBO PRO INOX 250W 2 CONOS + VASO+TAPA;TOKYO;JUGUERAS;PEQUEÑOS ELECTRODOMESTICOS;300.026;
etl.bascs.impala.clases.Producto@36562f;248;GEJMT-ESP;G642;7899511906917;50;EXPRIMIDORA D/JUG INDUST.METVISA TIPO ESP 50HZ 220V 1/4CV;METVISA;EXPRIMIDORAS COMERCIALES;GASTRONOMIA Y EQUIPOS COMERCIALES;905.000;
etl.bascs.impala.clases.Producto@188d72a;249;GEJIS-CSE;G1938;7895707641822;0;EXPRIMIDORA DE JUGOS INDUSTRIAL SKYMSEN MOD CSE 1/2 HP-220V/50HZ;SKYMSEN;EXPRIMIDORAS COMERCIALES;GASTRONOMIA Y EQUIPOS COMERCIALES;4.697.575;
etl.bascs.impala.clases.Producto@dbafbb;250;EDTETWIST-N;T2061;7841175010257;50;EXPRIMIDORA TOKYO TWIST 25W 600ML;TOKYO;JUGUERAS;PEQUEÑOS ELECTRODOMESTICOS;132.526;
etl.bascs.impala.clases.Producto@7e3b71;251;EDXEJU550D-N;MX104;;50;EXTRACTOR DE JUGO MOULINEX JU550D10 800W;MOULINEX;JUGUERAS;PEQUEÑOS ELECTRODOMESTICOS;670.000;
etl.bascs.impala.clases.Producto@cb9e7f;252;EDTEFMAX2;T2623;7841175015269;50;EXTRACTOR DE JUGOS TOKYO FRUIT MAX 600W 2 VELOC CAP PARA PULPA 1.5L;TOKYO;JUGUERAS;PEQUEÑOS ELECTRODOMESTICOS;251.987;
etl.bascs.impala.clases.Producto@127228b;253;EDTEFMAX2-N;T2542;7841175014040;50;EXTRACTOR DE JUGOS TOKYO FRUIT MAX 600W 2 VELOC CAP PARA PULPA 1.5L;TOKYO;JUGUERAS;PEQUEÑOS ELECTRODOMESTICOS;260.965;
etl.bascs.impala.clases.Producto@f4e2a3;254;GEJRC-J80U;G1974;;5;EXTRATOR DE JUGOS ROBOT COUPE MOD J80 ULTRA NP 230/50/1;ROBOT COUPE;EXPRIMIDORAS COMERCIALES;GASTRONOMIA Y EQUIPOS COMERCIALES;11.500.000;
etl.bascs.impala.clases.Producto@1c0eb3f;255;GFHE-ZBL90;G1685;7841175008919;50;FABRICADORA DE HIELO ECOSILKON MOD ZBL9 40/90KG/24H CAP DEPOSITO 48KG AC INOX FI;ECOSILKON;FABRICADORAS COMERCIALES;GASTRONOMIA Y EQUIPOS COMERCIALES;10.450.000;
etl.bascs.impala.clases.Producto@1f6b85e;256;GFHE-ZBP60;G2223;7841175014446;5;FABRICADORA DE HIELO ECOSILKON-ZBP60 30/50KG/24H CAP DEPOSITO 16KG-ACERO INOX;ECOSILKON;FABRICADORAS COMERCIALES;GASTRONOMIA Y EQUIPOS COMERCIALES;7.250.000;
etl.bascs.impala.clases.Producto@173fd11;257;CGFHTOKIM;T2430;7841175013166;50;FABRICADORA DE HIELO TOKYO TOK-IM 8.7KGS CARGA MANUAL INOX;TOKYO;FABRICADORAS DE HIELO RESIDENCIALES;REFRIGERACION;1.250.019;
etl.bascs.impala.clases.Producto@cffc26;258;GFHE-ZBL150;G1686;7841175008902;50;FABRICADORA HIELO ECOSILKON ZBL150 75/150KG/24H CAP DEP 90KG AC.INOX;ECOSILKON;FABRICADORAS COMERCIALES;GASTRONOMIA Y EQUIPOS COMERCIALES;13.715.000;
etl.bascs.impala.clases.Producto@3a67d3;259;GFHE-ZBL180;G1841;7841175010752;5;FABRICADORA HIELO ECOSILKON ZBL180 160KG/24H CAP DEP 160 KG AC.INOX;ECOSILKON;FABRICADORAS COMERCIALES;GASTRONOMIA Y EQUIPOS COMERCIALES;15.595.000;
etl.bascs.impala.clases.Producto@de0782;260;GFHE-ZBL280;G1842;7841175010769;50;FABRICADORA HIELO ECOSILKON ZBL280 250KG/24H CAP DEP 160 KG AC.INOX.;ECOSILKON;FABRICADORAS COMERCIALES;GASTRONOMIA Y EQUIPOS COMERCIALES;18.500.000;
etl.bascs.impala.clases.Producto@9efbd;261;GFHE-ZBL480;G1843;7841175010776;20;FABRICADORA HIELO ECOSILKON ZBL480 460KG/24H CAP DEP 160 KG AC.INOX;ECOSILKON;FABRICADORAS COMERCIALES;GASTRONOMIA Y EQUIPOS COMERCIALES;25.085.000;
etl.bascs.impala.clases.Producto@1d60296;262;EDPTRITRF30;TR87;7896260205629;20;FORRAJERA TRAPP TRF-300 2HP C/ CORREA;TRAPP;FORRAJERAS;JARDIN;4.089.077;
etl.bascs.impala.clases.Producto@e3e840;263;EDPTRF400;TR81;7896260205384;50;FORRAJERA TRAPP TRF-400 2HP;TRAPP;FORRAJERAS;JARDIN;3.146.856;
etl.bascs.impala.clases.Producto@c30a09;264;EDPTRITRF70;TR88;7896260205438;20;FORRAJERA TRAPP TRF-70 1.25HP MARTILLO FIJO;TRAPP;FORRAJERAS;JARDIN;2.122.158;
etl.bascs.impala.clases.Producto@186762b;265;GFRPG-PR310G;G273;7898466530673;50;FREIDORA A GAS PROGAS PR-310G;PROGAS;FREIDORAS COMERCIALES;GASTRONOMIA Y EQUIPOS COMERCIALES;395.000;
etl.bascs.impala.clases.Producto@7b0fbf;266;EDAFEY201-N;A466;3045380014671;50;FREIDORA ARNO AIR FRY SUPER EY201DB2 4.2L 220V 1400W;ARNO;FREIDORAS;PEQUEÑOS ELECTRODOMESTICOS;844.066;
