X;ID;Codigo;Alternativo;EAN;Stock;Descripcion;Marca;Categoria;Division;Precio;
etl.bascs.impala.clases.Producto@939afe;0;AACM20-TRCT360CWN1;T2566;7841175014392;5;AA COMPACTO TOKYO MOD TRCT360CWN1 360000BTU 380-415V 3N 50HZ CON FILTRO Y PORTA;TOKYO;AIRES TIPO COMPACTO;CLIMATIZACION;82.919.334;
etl.bascs.impala.clases.Producto@197f9a4;1;GAIB-IABT101L;G2338;7841175015238;0;ABATIDOR  INFRICOOL 10B  GN1/1 MOD IABT101L;INFRICOOL;REFRIGERACION COMERCIAL;GASTRONOMIA Y EQUIPOS COMERCIALES;34.375.020;
etl.bascs.impala.clases.Producto@49dfc8;2;GAIB-IABT31S;G2336;7841175015245;0;ABATIDOR  INFRICOOL 3B GN1/1 MOD IABT31S;INFRICOOL;REFRIGERACION COMERCIAL;GASTRONOMIA Y EQUIPOS COMERCIALES;17.999.952;
etl.bascs.impala.clases.Producto@a1960f;3;GAIB-ABT201CBI;G2334;7841175015191;0;ABATIDOR INFRICO 20B GN1/1 CARRO INT MOD ABT201CBI.;INFRICO;REFRIGERACION COMERCIAL;GASTRONOMIA Y EQUIPOS COMERCIALES;115.000.006;
etl.bascs.impala.clases.Producto@f5ac8f;4;GAIB-ABT201S;G2335;7841175015207;0;ABATIDOR INFRICO 20B GN1/1 MOD ABT201S.;INFRICO;REFRIGERACION COMERCIAL;GASTRONOMIA Y EQUIPOS COMERCIALES;120.500.036;
etl.bascs.impala.clases.Producto@4939ec;5;GAIB-ABT61C;G2332;7841175015214;0;ABATIDOR INFRICO 6B GN 1/1 COMPACT MOD ABT61C.;INFRICO;REFRIGERACION COMERCIAL;GASTRONOMIA Y EQUIPOS COMERCIALES;31.499.983;
etl.bascs.impala.clases.Producto@741b72;6;GAIB-ABT71L;G2333;7841175015221;0;ABATIDOR INFRICO 7B GN 1/1  LARGA MOD ABT71L.;INFRICO;REFRIGERACION COMERCIAL;GASTRONOMIA Y EQUIPOS COMERCIALES;34.499.975;
etl.bascs.impala.clases.Producto@c9ff1d;7;GAIB-IABT51L;G2337;7841175015252;0;ABATIDOR INFRICOOL 5B GN1/1 MOD IABT51L;INFRICOOL;REFRIGERACION COMERCIAL;GASTRONOMIA Y EQUIPOS COMERCIALES;23.499.982;
etl.bascs.impala.clases.Producto@145b45f;8;GIMEVOAB50-N;GI67;7898953407297;50;ABDOMINALERA EVOLUTION TOTAL CRUNCH AB50;EVOLUTION;COMPLEMENTOS FITNESS;FITNESS;706.984;
etl.bascs.impala.clases.Producto@dc6642;9;GAM-PAC;G1526;7899511901653;5;ABLANDADOR DE CARNE METVISA TIPO PAC 1/2 HP 220V/50 HZ;METVISA;REBANADORES COMERCIALES;GASTRONOMIA Y EQUIPOS COMERCIALES;3.285.000;
etl.bascs.impala.clases.Producto@f4ce0;10;GAAFMS-AMP5;G1941;7895707641877;0;ABRIDORA. APLASTADORA. FORMADORA DE MASAS SKYMSEN MOD AMP-500 1/2HP 220V/50HZ;SKYMSEN;EQUIPOS DE PANADERIA;GASTRONOMIA Y EQUIPOS COMERCIALES;20.655.000;
etl.bascs.impala.clases.Producto@1016b2b;11;272;272;;0;ACONDICIONADOR DE AIRE  TOKYO EXTENSE 36000BTU;TOKYO;AIRES SPLITS PARED;CLIMATIZACION;7.264.944;
etl.bascs.impala.clases.Producto@1a6c618;12;343;343;;50;ACONDICIONADOR DE AIRE CASSETTE SLIM, MARCA AUX, 60000 BTU/H, 380-415V-3Ph-50Hz;AUX;AIRES SPLITS CASETTE;CLIMATIZACION;12.135.443;
etl.bascs.impala.clases.Producto@d95018;13;284;284;;20;ACONDICIONADOR DE AIRE SPLIT CASSETTE SLIM CIRCULAR, MARCA  AUX, 18000 BTU/H, 220-240V-1Ph-50Hz;AUX;AIRES SPLITS CASETTE;CLIMATIZACION;6.019.951;
etl.bascs.impala.clases.Producto@c568af;14;285;285;;20;ACONDICIONADOR DE AIRE SPLIT CASSETTE SLIM CIRCULAR, MARCA AUX, 24000 BTU/H, 220-240V-1Ph-50Hz;AUX;AIRES SPLITS CASETTE;CLIMATIZACION;7.249.936;
etl.bascs.impala.clases.Producto@a7112f;15;293;293;;5;ACONDICIONADOR DE AIRE SPLIT DUCTO SLIM SILUETA BAJA, MARCA AUX, 24000 BTU/H, 220-240V-1Ph-50Hz;AUX;DUCTOS COMERCIALES;CLIMATIZACION;7.489.930;
etl.bascs.impala.clases.Producto@17694e5;16;294;294;;5;ACONDICIONADOR DE AIRE SPLIT DUCTO SLIM SILUETA BAJA, MARCA AUX, 36.000 BTU/H, 220-240V-1Ph-50Hz;AUX;AIRES TIPO DUCTO;CLIMATIZACION;10.709.950;
etl.bascs.impala.clases.Producto@1054043;17;295;295;;0;ACONDICIONADOR DE AIRE SPLIT DUCTO SLIM SILUETA BAJA, MARCA AUX, 60.000 BTU/H, 220-240V-1Ph-50Hz;AUX;AIRES TIPO DUCTO;CLIMATIZACION;13.599.928;
etl.bascs.impala.clases.Producto@3ac89c;18;296;296;;5;ACONDICIONADOR DE AIRE SPLIT INVERTER DUCTO SLIM SILUETA BAJA, MARCA AUX, 24000 BTU/H, 220-240V-1Ph-50Hz;AUX;DUCTOS COMERCIALES;CLIMATIZACION;11.150.140;
etl.bascs.impala.clases.Producto@82805d;19;316;316;;50;ACONDICIONADOR DE AIRE SPLIT PARED YORK 18.000BTU ON/OFF C/ CONTROL 50HZ 220V-240V;YORK;AIRES SPLITS PARED;CLIMATIZACION;4.099.998;
etl.bascs.impala.clases.Producto@10ef054;20;269;269;;20;ACONDICIONADOR DE AIRE TOKYO CASSETTE 4 VÍAS INVERTER 24000 BTU  220V-240V/50Hz/1Ph;TOKYO;AIRES SPLITS CASETTE;CLIMATIZACION;11.900.005;
etl.bascs.impala.clases.Producto@e0b9ae;21;235;235;;50;ACONDICIONADOR DE AIRE TOKYO CASSETTE 4 VÍAS INVERTER ECH18-CI-36CHR1 36000BTU F/C HORIZ 380V-415V/3P/50Hz;TOKYO;AIRES SPLITS CASETTE;CLIMATIZACION;12.200.031;
etl.bascs.impala.clases.Producto@34e4c6;22;236;236;;50;ACONDICIONADOR DE AIRE TOKYO CASSETTE 4 VÍAS INVERTER ECH18-CI-48CHR1 48000BTU F/C HORIZ 380V-415V/3P/50Hz;TOKYO;AIRES SPLITS CASETTE;CLIMATIZACION;12.500.057;
etl.bascs.impala.clases.Producto@4a1275;23;311;311;;50;ACONDICIONADOR DE AIRE TOKYO CASSETTE INVERTER ROUND FLOW  CA20-CI-60CHR1 60000BTU F/C HORIZ 380V-415V;TOKYO;AIRES SPLITS CASETTE;CLIMATIZACION;18.002.231;
etl.bascs.impala.clases.Producto@6cf38;24;268;268;;5;ACONDICIONADOR DE AIRE TOKYO CASSETTE ROUND FLOW F/C 24000BTU CTFH20-C-24CHR1 DESC HORIZ 220V/50HZ;TOKYO;AIRES SPLITS CASETTE;CLIMATIZACION;7.249.937;
etl.bascs.impala.clases.Producto@170321f;25;276;276;;0;ACONDICIONADOR DE AIRE TOKYO CASSETTE ROUND FLOW MOD CCH18-C-36CHR1 36000BTU HORIZONTAL FRIO/CALOR;TOKYO;AIRES SPLITS CASETTE;CLIMATIZACION;8.949.995;
etl.bascs.impala.clases.Producto@31e623;26;266;266;;0;ACONDICIONADOR DE AIRE TOKYO CASSETTE ROUND FLOW SLIM F/C60000BTU CCH18-CS-60CHR1 DESC VERT 380V/3/50HZ;TOKYO;AIRES SPLITS CASETTE;CLIMATIZACION;11.394.959;
etl.bascs.impala.clases.Producto@b29daa;27;184;184;;5;ACONDICIONADOR DE AIRE TOKYO DUCTO VERTICAL F/C 48000BTU MOD ECH18-DV-48CHR1 220V/50HZ;TOKYO;AIRES TIPO DUCTO;CLIMATIZACION;9.249.886;
etl.bascs.impala.clases.Producto@31fe8b;28;327;327;;50;ACONDICIONADOR DE AIRE TOKYO EXTENSE IONIC CAE21-18CHR1 18000BTU C/CONT 220V-240V;TOKYO;AIRES SPLITS PARED;CLIMATIZACION;4.099.998;
etl.bascs.impala.clases.Producto@c1d8d8;29;328;328;;50;ACONDICIONADOR DE AIRE TOKYO EXTENSE IONIC CAE21-24CHR1 24000BTU C/CONTROL KIT INCLUIDO 220V-240V;TOKYO;AIRES SPLITS PARED;CLIMATIZACION;5.785.048;
etl.bascs.impala.clases.Producto@18c289d;30;323;323;;50;ACONDICIONADOR DE AIRE TOKYO EXTENSE IONIC EAE21-I12CHR1 12000BTU C/CONT 220V-240V;TOKYO;AIRES SPLITS PARED;CLIMATIZACION;2.515.046;
etl.bascs.impala.clases.Producto@1dfbdcb;31;332;332;;50;ACONDICIONADOR DE AIRE TOKYO EXTENSE IONIC EAE21-I30CHR1 30000BTU C/CONTROL KIT INCLUIDO 220V-240V;TOKYO;AIRES SPLITS PARED;CLIMATIZACION;7.099.990;
etl.bascs.impala.clases.Producto@f1d85d;32;257;257;;50;ACONDICIONADOR DE AIRE TOKYO MOD 60CHR1 60000BTU/H PISO/TECHO GAS ECOLOGICO R410A FC/C-DESC. SUPERIOR 380V-415V;TOKYO;AIRES SPLITS PISO-TECHO;CLIMATIZACION;10.819.964;
etl.bascs.impala.clases.Producto@8cdc43;33;330;330;;20;ACONDICIONADOR DE AIRE TOKYO SPLIT CASSETTE 18.000 BTU/H, ROUND FLOW 220V/50HZ;TOKYO;AIRES SPLITS CASETTE;CLIMATIZACION;6.180.483;
etl.bascs.impala.clases.Producto@1cc08f;34;324;324;;50;ACONDICIONADOR DE AIRE YORK 12.000BTU INVERTER R410A SIN KIT DE INSTALACION 220V-240V;YORK;AIRES SPLITS PARED;CLIMATIZACION;3.733.508;
etl.bascs.impala.clases.Producto@e50b22;35;315;315;;5;ACONDICIONADOR DE AIRE YORK 12.000BTU ON/OFF CON CONTROL 50HZ;YORK;AIRES SPLITS PARED;CLIMATIZACION;2.428.683;
etl.bascs.impala.clases.Producto@860ed3;36;325;325;;50;ACONDICIONADOR DE AIRE YORK 18.000BTU INVERTER R410A SIN KIT DE INSTALACION 220V-240V;YORK;AIRES SPLITS PARED;CLIMATIZACION;5.433.298;
etl.bascs.impala.clases.Producto@2aa8c4;37;314;314;;20;ACONDICIONADOR DE AIRE,  TOKYO CASSETTE F/C 24000BTU ETFH21-C-24CHR1 DESC HORIZ 220V/50HZ;TOKYO;AIRES SPLITS CASETTE;CLIMATIZACION;7.249.937;
etl.bascs.impala.clases.Producto@281c36;38;291;291;;5;ACONDICIONADORES DE AIRE  SPLIT PISO TECHO SLIM, MARCA AUX, 48000 BTU/H, 220-240V-1Ph-50Hz;AUX;AIRES SPLITS PISO-TECHO;CLIMATIZACION;11.050.042;
etl.bascs.impala.clases.Producto@88ac8a;39;255;255;;0;ACONDICIONADORES DE AIRE LG INVERTER, 48.000 btu/h, F/C,-220-240V-1F-50/60Hz;LG;AIRES SPLITS CASETTE;CLIMATIZACION;13.275.381;
etl.bascs.impala.clases.Producto@2cdede;40;287;287;;5;ACONDICIONADORES DE AIRE SPLIT CASSETTE SLIM CIRCULAR, MARCA AUX, 48000 BTU/H, 220-240V-1Ph-50;AUX;AIRES SPLITS CASETTE;CLIMATIZACION;11.185.516;
etl.bascs.impala.clases.Producto@1b32417;41;252;252;;0;ACONDICIONADORES DE AIRE TECHO SUSPENDIDO LG INVERTER, 48.000 BTU/H, F/C,380-420V-3F-50/60HZ;LG;AIRES SPLITS PISO-TECHO;CLIMATIZACION;14.752.864;
etl.bascs.impala.clases.Producto@186417b;42;183;183;;0;ACONDICIONADORES DE AIRE TOKYO SWING SWAY 12000BTU ETFH18-12CHR1;TOKYO;AIRES SPLITS PARED;CLIMATIZACION;1.743.876;
etl.bascs.impala.clases.Producto@8f4e7d;43;297;297;;5;ACONDICIONDORES DE AIRE SPLIT INVERTER DUCTO SLIM SILUETA BAJA, MARCA AUX, 36.000 BTU/H, 220-240V-1Ph-50Hz;AUX;AIRES TIPO DUCTO;CLIMATIZACION;12.239.828;
etl.bascs.impala.clases.Producto@c7b95c;44;ELECHHUB;CH8;7841175015641;50;ADAPTADOR MINI USB-C HDMI, RJ45, RED, TARJETA DE MEMORIA;CHUWI;COMPUTADORAS;TV/AUDIO/VIDEO;199.995;
etl.bascs.impala.clases.Producto@caa74f;45;EDRAPR1335-N;R231;;50;AFEITADORA ELECTRICA MOD PR1335-BATERIA RECARGABLE LED INDICADOR DE CARGA;REMINGTON;AFEITADORAS;CUIDADO PERSONAL;249.977;
etl.bascs.impala.clases.Producto@18eb1f4;46;EDRAPF7200-N;R223;074590541519;50;AFEITADORA REMINGTON MOD PF7200 COMFORT SERIES TECNOLOGIA FLEX FOIL + ADAPTADOR;REMINGTON;AFEITADORAS;CUIDADO PERSONAL;192.357;
etl.bascs.impala.clases.Producto@116f05e;47;EDRPS1305-N;R243;074590547047;50;ALISADOR DE PELO REMINGTON MOD S1305;REMINGTON;ALISADORES;CUIDADO PERSONAL;126.295;
etl.bascs.impala.clases.Producto@aab3b9;48;EDRPS12A-N;R252;074590553420;50;ALISADOR DE PELO REMINGTON S-12A CON AGUACATE + MACADAMIA SHINE THERAPY;REMINGTON;ALISADORES;CUIDADO PERSONAL;256.543;
etl.bascs.impala.clases.Producto@11d9dfc;49;EDRPS9600-N;R234;074590530759;50;ALISADOR DE PELO REMINGTON S-9600 SILK-46W 240NC CERAMICA AVANZADA CON SEDA;REMINGTON;ALISADORES;CUIDADO PERSONAL;466.722;
etl.bascs.impala.clases.Producto@1b2843a;50;EDRAS8607-N;R253;074590552133;50;ALISADOR DE PELO REMINGTON S8607 ADVANCED THERATY CON COCO;REMINGTON;ALISADORES;CUIDADO PERSONAL;459.017;
etl.bascs.impala.clases.Producto@12e0c92;51;EDRPS27A;R257;74590555271;50;ALISADOR REMINGTON MOD S27A WET2STRAIGHT CERAMICA AVANZADA USO SECO Y MOJADO;REMINGTON;ALISADORES;CUIDADO PERSONAL;295.001;
etl.bascs.impala.clases.Producto@425db5;52;EDRWASF75-N;RW40;3121040059586;50;ALISADOR ROWENTA BRUSH AND STRAIGHT 200C SF75;ROWENTA;ALISADORES;CUIDADO PERSONAL;227.465;
etl.bascs.impala.clases.Producto@115c4bc;53;EDRWASF62-N;RW36;;50;ALISADOR ROWENTA LISS & CURL ULTIMATE SHINE DOBLE ION;ROWENTA;ALISADORES;CUIDADO PERSONAL;213.998;
etl.bascs.impala.clases.Producto@f501f0;54;GAETI-LM20;G2050;693239881918;20;AMASADORA ESPIRAL TOKYO INDUSTRIAL MOD LM20 CAP 20LTS AMASADO 8KGS 0.75KW 220V;TOKYO INDUSTRIAL;EQUIPOS DE PANADERIA;GASTRONOMIA Y EQUIPOS COMERCIALES;6.765.000;
etl.bascs.impala.clases.Producto@120dba0;55;COTOKANKA6400-N;T2511;7841175014248;50;ANAFE A GAS TOKYO ANKA INOXIDABLE 4 HORNALLAS ENCEND. ELÉCTRICO COMANDO LATERAL;TOKYO;ANAFES DE EMPOTRAR;COCCION;649.967;
etl.bascs.impala.clases.Producto@1299e44;56;COTOKMON-N;T2223;7841175006113;20;ANAFE A INDUCCION TOKYO MOD MONALISA 4HORN;TOKYO;ANAFES DE EMPOTRAR;COCCION;2.691.658;
etl.bascs.impala.clases.Producto@a681b9;57;COTOKODA-N;T2222;7841175006120;20;ANAFE A INDUCCION TOKYO MOD ODALISA 2HORN;TOKYO;ANAFES DE EMPOTRAR;COCCION;1.669.975;
etl.bascs.impala.clases.Producto@96e65c;58;COARHR611CA-N;AR13;8050147042984;50;ANAFE ARISTON ELECTRICO HR611CA 4HOR VITROCERAMICO TOUCH;ARISTON;ANAFES DE EMPOTRAR;COCCION;2.965.018;
etl.bascs.impala.clases.Producto@190c5f5;59;COTOKANKA31-N;T2139;7841175008506;50;ANAFE COMBINADO TOKYO ANKA INOXIDABLE 3 HORNALLAS A GAS Y 1ELECTRICO;TOKYO;ANAFES DE EMPOTRAR;COCCION;690.033;
etl.bascs.impala.clases.Producto@5cbabd;60;COTOK2V2I-N;T2329;7841175012060;20;ANAFE ELECTRICO COMBINADA TOKYO 4 H 2 VITROCERAMICA 2 INDUCCION MD TOK2V2I;TOKYO;ANAFES DE EMPOTRAR;COCCION;1.500.800;
etl.bascs.impala.clases.Producto@274006;61;COTOK4HVC-N;T2328;;50;ANAFE ELECTRICO TOKYO 4 HORNALLAS VITROCERAMICA MOD TOK4HVC;TOKYO;ANAFES DE EMPOTRAR;COCCION;1.250.019;
etl.bascs.impala.clases.Producto@11ae018;62;COARNIA640B;AR15;8050147041512;20;ANAFE INDUCCION ARISTON NIA640B 4HOR VITROCERAMICO TOUCH;ARISTON;ANAFES DE EMPOTRAR;COCCION;4.630.236;
etl.bascs.impala.clases.Producto@f623e3;63;COTOCOOK4;T1805;7896518512974;50;ANAFE TOKYO A GAS COOK 4 HORNALLAS SABAF VIDRIO TEMPLADO;TOKYO;ANAFES DE EMPOTRAR;COCCION;730.032;
etl.bascs.impala.clases.Producto@158e312;64;COTOCOOK5;T1806;7896518512189;50;ANAFE TOKYO A GAS COOK 5 HORNALLAS SABAF VIDRIO TEMPLADO;TOKYO;ANAFES DE EMPOTRAR;COCCION;900.011;
etl.bascs.impala.clases.Producto@157ab8f;65;COWHAKM9010NE-N;W432;8003437829536;20;ANAFE WHIRLPOOL ELECTRICO AKM9010NE 4HORN VITROCERAMICO C/ PERILLAS;WHIRLPOOL;ANAFES DE EMPOTRAR;COCCION;2.990.009;
etl.bascs.impala.clases.Producto@1118b5d;66;COWHACM806BA-N;W423;8003437826030;20;ANAFE WHIRLPOOL INDUCCION ACM806BA 4HOR VITROCERAMICO TOUCH;WHIRLPOOL;ANAFES DE EMPOTRAR;COCCION;4.070.585;
etl.bascs.impala.clases.Producto@9148e7;67;GAT-HW-450;G2147;6932398819275;20;APLICADOR DE FILM TOKYO INDUSTRIAL 45CMS MOD HW-450;TOKYO INDUSTRIAL;EMBASADORAS GASTRONOMICAS;GASTRONOMIA Y EQUIPOS COMERCIALES;775.000;
etl.bascs.impala.clases.Producto@e967d4;68;EDPASF3000-N;TR124;7896260221940;50;ASPIRADOR DE HOJAS TRAPP SF3000 C/ BOLSA 32L;TRAPP;ACCESORIOS JARDIN;JARDIN;642.932;
etl.bascs.impala.clases.Producto@88a4d5;69;EDTASCFORTE810-N;T2457;7841175013333;50;ASPIRADORA TOKYO COMPACT FORTE 1400W CAP 23LTS 220V/50HZ;TOKYO;ASPIRADORAS;PEQUEÑOS ELECTRODOMESTICOS;599.985;
etl.bascs.impala.clases.Producto@1c49afa;70;EDTASSK601-N;T2458;7841175013326;50;ASPIRADORA TOKYO SKINNY DE POLVO 2 EN 1 600W 5OHZ;TOKYO;ASPIRADORAS;PEQUEÑOS ELECTRODOMESTICOS;180.029;
etl.bascs.impala.clases.Producto@17a2a95;71;ELSWS623;S82;4548736040601;5;AURICULAR MP3 SONY NW-WS623 4GB BLACK;SONY;HEADPHONES;TV/AUDIO/VIDEO;829.996;
etl.bascs.impala.clases.Producto@3c2169;72;ELPHSHB2505BK10-N;P367;4895229100473;50;AURICULAR PHILIPS IN EAR SHB2505BK/10 NEGRO, MIC, BT, 15HS BAT.;PHILIPS;HEADPHONES;TV/AUDIO/VIDEO;479.988;
etl.bascs.impala.clases.Producto@1678a77;73;ELPHSHE1405BK10-N;P363;6951613981603;50;AURICULAR PHILIPS IN EAR SHE1405BK/10 MIC, CABLE 1.2M,;PHILIPS;HEADPHONES;TV/AUDIO/VIDEO;49.982;
etl.bascs.impala.clases.Producto@e7c4ab;74;ELPHSHQ1405BL00-N;P366;6951613991800;50;AURICULAR PHILIPS IN EAR SPORT SHQ1405BL/00 MIC, RES. AGUA, CABLE KEVLAR;PHILIPS;HEADPHONES;TV/AUDIO/VIDEO;119.997;
etl.bascs.impala.clases.Producto@c76da0;75;ELPHSHL5005WT00-N;P364;6951613991442;50;AURICULAR PHILIPS ON EAR SHL5005WT/00  BLANCO MIC, CABLE 1.2M;PHILIPS;HEADPHONES;TV/AUDIO/VIDEO;100.031;
etl.bascs.impala.clases.Producto@15f3778;76;ELPHTAH4105BK00;P372;4895229109681;50;AURICULAR PHILIPS OVER EAR TAH4105BK/00 NEGRO MIC, CABLE 1.2MP;PHILIPS;HEADPHONES;TV/AUDIO/VIDEO;140.030;
etl.bascs.impala.clases.Producto@ec2016;77;ELSEX15AP-PINK;S85;27242869486;20;AURICULAR SONY MDR-EX15AP PINK C/MIC.;SONY;HEADPHONES;TV/AUDIO/VIDEO;70.015;
etl.bascs.impala.clases.Producto@387ffc;78;ELSXB650BT-BLACK;S87;4548736021549;0;AURICULAR SONY MDR-XB650BT BLACK;SONY;HEADPHONES;TV/AUDIO/VIDEO;749.998;
etl.bascs.impala.clases.Producto@18fbb36;79;ELSZX110-BLACK;S88;027242867086;50;AURICULAR SONY MDR-ZX110 BLACK;SONY;HEADPHONES;TV/AUDIO/VIDEO;96.011;
etl.bascs.impala.clases.Producto@11ba808;80;ELSZX110-PINK;S89;27242868854;50;AURICULAR SONY MDR-ZX110 PINK;SONY;HEADPHONES;TV/AUDIO/VIDEO;96.011;
etl.bascs.impala.clases.Producto@98da2d;81;ELSWFXB700-BLACK;S127;;5;AURICULAR SONY WF-XB700 BLACK;SONY;HEADPHONES;TV/AUDIO/VIDEO;749.998;
etl.bascs.impala.clases.Producto@184811d;82;ELSWI-C200-BL;S118;27242916012;5;AURICULAR SONY WI-C200 C/BLUETOOTH BLACK;SONY;HEADPHONES;TV/AUDIO/VIDEO;220.028;
etl.bascs.impala.clases.Producto@1aac410;83;ELSWI-C200-WH;S119;27242916029;5;AURICULAR SONY WI-C200 C/BLUETOOTH WHITE;SONY;HEADPHONES;TV/AUDIO/VIDEO;220.028;
etl.bascs.impala.clases.Producto@15960c5;84;GBLT-ACSP2NV;G1721;7841175009534;50;BALANZA COMERCIAL TOKYO IND ACS-P2 CON IMPRESORA 10gr a 30kg-PARA 5 DIGITOS 220;TOKYO INDUSTRIAL;BALANZAS COMERCIALES;GASTRONOMIA Y EQUIPOS COMERCIALES;1.180.000;
etl.bascs.impala.clases.Producto@1cc9971;85;GBLT-ACSL2NV;G1720;7841175009527;50;BALANZA COMERCIAL TOKYO IND MOD ACS-L2 CON TORRE-LED DISPLAY 5gr a 30kg 220v/50;TOKYO INDUSTRIAL;BALANZAS COMERCIALES;GASTRONOMIA Y EQUIPOS COMERCIALES;400.000;
etl.bascs.impala.clases.Producto@a565bc;86;EDTBTOKABS-N;T2130;7841175007974;50;BALANZA DE COCINA TOKABS BOWL DE PLASTICO FUNCION TARA CAP 5KGS;TOKYO;BALANZAS DE COCINA;PEQUEÑOS ELECTRODOMESTICOS;54.940;
etl.bascs.impala.clases.Producto@1c0aefc;87;EDTBTOKINOX;T1823;7841175007981;50;BALANZA DE COCINA TOKINOX BOWL 1.7LTS INOX FUNCION TARA CAP 5KGS;TOKYO;BALANZAS DE COCINA;PEQUEÑOS ELECTRODOMESTICOS;150.080;
etl.bascs.impala.clases.Producto@145a189;88;GBTK-ACSC30;G1636;7841175007592;50;BALANZA ELECTRONICA TOKYO INDUSTRIAL MOD ACS-C 30KGS C/BATERIA 220V;TOKYO INDUSTRIAL;BALANZAS COMERCIALES;GASTRONOMIA Y EQUIPOS COMERCIALES;350.000;
etl.bascs.impala.clases.Producto@ebb441;89;EDTBTOK8012-N;T2371;7841175007004;50;BALANZA TOKYO P/PERSONAS MOD TOK8012 TOP CAP MAX 150KGS NEGRO;TOKYO;BALANZAS DE BAÑO;CUIDADO PERSONAL;117.786;
etl.bascs.impala.clases.Producto@160afe5;90;EDTBTOK926-N;T2244;7841175007011;50;BALANZA TOKYO P/PERSONAS TOK926 SLIM CAP MAX 180KGS VERDE;TOKYO;BALANZAS DE BAÑO;CUIDADO PERSONAL;126.228;
etl.bascs.impala.clases.Producto@11540bb;91;GB11025-N;G1785;;50;BANDEJA GASTRONOMICA TOKYO INDUSTRIAL MOD 11025 1/1 PLANA;TOKYO INDUSTRIAL;ASADERAS / BANDEJAS GASTRONOMICAS;GASTRONOMIA Y EQUIPOS COMERCIALES;54.810;
etl.bascs.impala.clases.Producto@16cee79;92;GB12065-N;G1786;6932398814294;50;BANDEJA GASTRONOMICA TOKYO INDUSTRIAL MOD 12065 1/2 4.5 LTRS;TOKYO INDUSTRIAL;ASADERAS / BANDEJAS GASTRONOMICAS;GASTRONOMIA Y EQUIPOS COMERCIALES;33.900;
etl.bascs.impala.clases.Producto@cc1329;93;GB8112P-N;G1987;6932398806541;20;BANDEJA GASTRONOMICA TOKYO INDUSTRIAL PERFORADA MOD 811-2P;TOKYO INDUSTRIAL;ASADERAS / BANDEJAS GASTRONOMICAS;GASTRONOMIA Y EQUIPOS COMERCIALES;69.600;
etl.bascs.impala.clases.Producto@619ed2;94;GBTOP1525-N;G1414;6932398814355;50;BANDEJA PERFORADA TOKYO INDUSTRIAL MOD OP1525 40X60X25 MM;TOKYO INDUSTRIAL;ASADERAS / BANDEJAS GASTRONOMICAS;GASTRONOMIA Y EQUIPOS COMERCIALES;167.730;
etl.bascs.impala.clases.Producto@1ae153d;95;ELTBSF50W-N;T2558;7841175014279;50;BARRA DE SONIDO C/ SUBWOOFER TOKYO OPTICAL HDMI USB/BT/MP3/MP4/AUX + CONTROL 220;TOKYO;BARRA DE SONIDO;TV/AUDIO/VIDEO;650.034;
etl.bascs.impala.clases.Producto@1933457;96;ELPHTAB510512;P371;;50;BARRA DE SONIDO PHILIPS TAB510512 BL, HDMI ARC;PHILIPS;BARRA DE SONIDO;TV/AUDIO/VIDEO;449.972;
etl.bascs.impala.clases.Producto@10a2657;97;GBCM-5310;G2094;7898923191546;0;BARRIL PARA CERVEZA MEMO DE 10 LITROS INOX MOD 5310;MEMO;BARRILES;GASTRONOMIA Y EQUIPOS COMERCIALES;2.193.500;
etl.bascs.impala.clases.Producto@18fba6a;98;GBCM-4774;G2095;7898923191553;0;BARRIL PARA CERVEZA MEMO DE 30 LITROS INOX MOD 4774;MEMO;BARRILES;GASTRONOMIA Y EQUIPOS COMERCIALES;2.460.000;
etl.bascs.impala.clases.Producto@39471b;99;GBARTI-LRFM5;G2063;6932398819268;50;BATIDORA ALTA ROTACION TOKYO INDUSTRIAL CAP 5LTS MOD LRFM5 220V 50HZ;TOKYO INDUSTRIAL;BATIDORAS COMERCIALES;GASTRONOMIA Y EQUIPOS COMERCIALES;2.350.000;
etl.bascs.impala.clases.Producto@72eb47;100;EDABSM00;A516;7895500757157;50;BATIDORA ARNO CHEF WHITE;ARNO;BATIDORAS;PEQUEÑOS ELECTRODOMESTICOS;449.972;
etl.bascs.impala.clases.Producto@345340;101;EDABSX15;A397;7895500720199;50;BATIDORA ARNO FACILITA-SX15 BLANCA 4LTS 3VEL 220V;ARNO;BATIDORAS;PEQUEÑOS ELECTRODOMESTICOS;255.538;
etl.bascs.impala.clases.Producto@28f4c6;102;EDABPCISX71;A499;7895500742986;50;BATIDORA ARNO PLANETARIA INSPIRART SX71 NEGRA;ARNO;BATIDORAS;PEQUEÑOS ELECTRODOMESTICOS;550.003;
etl.bascs.impala.clases.Producto@6f7347;103;EDABPISX71;A500;7895500756921;50;BATIDORA ARNO PLANETARIA INSPIRART SX71 ROJA;ARNO;BATIDORAS;PEQUEÑOS ELECTRODOMESTICOS;550.003;
etl.bascs.impala.clases.Producto@126991e;104;EDABSX16;A399;7895500721028;50;BATIDORA FACILITA ARNO SX16 3 VELOC NEGRO 220V;ARNO;BATIDORAS;PEQUEÑOS ELECTRODOMESTICOS;257.749;
etl.bascs.impala.clases.Producto@1a279e9;105;GBK-5KSMER-N;G1469;5413184104139;50;BATIDORA KITCHENAID ARTISAN 5KSM150PSEER EMPIRE RED 4.8L;KITCHENAID;BATIDORAS;PEQUEÑOS ELECTRODOMESTICOS;3.487.000;
etl.bascs.impala.clases.Producto@a32b5f;106;GBK-5KSMOB-N;G1299;5413184104177;5;BATIDORA KITCHENAID ARTISAN 5KSM150PSEOB ONYX BLACK 4.8L;KITCHENAID;BATIDORAS;PEQUEÑOS ELECTRODOMESTICOS;3.270.800;
etl.bascs.impala.clases.Producto@1a39c07;107;GBK5KSM175PSECA;G2310;5413184200480;50;BATIDORA KITCHENAID ARTISAN 5KSM175PSECA CANDY APPLE 4.8L;KITCHENAID;BATIDORAS;PEQUEÑOS ELECTRODOMESTICOS;3.270.800;
etl.bascs.impala.clases.Producto@960c84;108;GBK5KSM175PSEOB;G2370;883049481838;20;BATIDORA KITCHENAID ARTISAN 5KSM175PSEOB ONYX BLACK 4.8L;KITCHENAID;BATIDORAS;PEQUEÑOS ELECTRODOMESTICOS;3.600.000;
etl.bascs.impala.clases.Producto@2d5cce;109;GBK5KSM175PSEPT-N;G2068;5413184200718;20;BATIDORA KITCHENAID ARTISAN 5KSM175PSEPT PISTACHO 4.8L;KITCHENAID;BATIDORAS;PEQUEÑOS ELECTRODOMESTICOS;3.600.000;
etl.bascs.impala.clases.Producto@1876007;110;GBKHM9212EER-N;G1925;5413184160326;5;BATIDORA KITCHENAID DE MANO 5KHM9212EER EMPIRE RED 9VEL;KITCHENAID;BATIDORAS;PEQUEÑOS ELECTRODOMESTICOS;1.055.340;
etl.bascs.impala.clases.Producto@679b94;111;GBM-BAM12;G1668;7899511904005;0;BATIDORA MECANICA METVISA BAM-12 220V ? HP INOX;METVISA;GASTRONOMIA;GASTRONOMIA Y EQUIPOS COMERCIALES;4.675.000;
etl.bascs.impala.clases.Producto@414d70;112;GBM-BMK;G1129;7899511901066;5;BATIDORA METVISA MILK SHAKE 220V 50HZ NRO 17/21;METVISA;BATIDORAS COMERCIALES;GASTRONOMIA Y EQUIPOS COMERCIALES;801.500;
etl.bascs.impala.clases.Producto@52b85a;113;EDABPDSX71;A474;7895500742986;50;BATIDORA PLANETARIA DELUXE INOX SX71 NEGRA 4L;ARNO;BATIDORAS;PEQUEÑOS ELECTRODOMESTICOS;1.028.718;
etl.bascs.impala.clases.Producto@f6ecf;114;EDXBPS6PWE-N;MX110;3016661155932;20;BATIDORA PLANETARIA MOULINEX SOLEIL IVORY 900W;MOULINEX;BATIDORAS;PEQUEÑOS ELECTRODOMESTICOS;1.559.780;
etl.bascs.impala.clases.Producto@cafce1;115;EDTOKBPLANET;T2709;7841175016259;50;BATIDORA TOKYO  PLANETARIA PRO NEGRA 12 VEL. BOWL 4,5L 700W;TOKYO;BATIDORAS;PEQUEÑOS ELECTRODOMESTICOS;690.033;
etl.bascs.impala.clases.Producto@7c0605;116;EDTBMAX5-N;T2424;7841175012992;50;BATIDORA TOKYO BATIMAX BLANCA 5 VELOCIDADES 1 BOWL INOX 3 LTS 220V/50HZ;TOKYO;BATIDORAS;PEQUEÑOS ELECTRODOMESTICOS;197.650;
etl.bascs.impala.clases.Producto@137f0f8;117;EDTBSAN5-N;T2425;7841175013005;50;BATIDORA TOKYO BATISAN NEGRA 5 VELOCIDADES 1 BOWL INOX 3 LTS 220V/50HZ;TOKYO;BATIDORAS;PEQUEÑOS ELECTRODOMESTICOS;197.650;
etl.bascs.impala.clases.Producto@a18a87;118;EDTBTOK1091P-N;T2129;7841175006306;50;BEBEDERO TOKYO DE PIE AGUA FRIA/CALIENTE TOK1091P;TOKYO;BEBEDEROS PARA BIDON;REFRIGERACION;759.981;
etl.bascs.impala.clases.Producto@1315bc6;119;GIMEVB802-N;GI75;7841175013180;50;BICICLETA ESTATICA EVOLUTION B802 120KG DISCO 4KG;EVOLUTION;BICICLETAS ESTATICAS;FITNESS;1.150.323;
etl.bascs.impala.clases.Producto@1eb260b;120;EDRHBM30-I;RH23;;5;BOMBA CALOR PISCINA RHEEM CROSSWIND-30-I-M-220V/1 PH/50HZ;RHEEM;CLIMATIZACION PARA PISCINA;CLIMATIZACION;15.000.027;
etl.bascs.impala.clases.Producto@149abfe;121;EDRHBM50-I;RH16;;5;BOMBA CALOR PISCINA RHEEM CROSSWIND-50-I-M. 220V/1 Ph/50Hz;RHEEM;CLIMATIZACION PARA PISCINA;CLIMATIZACION;20.500.057;
etl.bascs.impala.clases.Producto@1f2e3a2;122;EDPBM1000P;TR151;7896260221612;50;BORDEADORA TRAPP MASTER 1000 PLUS 1000W S/ RUEDAS;TRAPP;BORDEADORAS;JARDIN;304.247;
etl.bascs.impala.clases.Producto@6861b1;123;EDPBMAT1500;TR164;7899812222686;50;BORDEADORA TRAPP MASTER AT-1500 1500W S/ RUEDAS;TRAPP;BORDEADORAS;JARDIN;325.821;
etl.bascs.impala.clases.Producto@83ccc9;124;EDPBTM1800;TR165;7899812222693;50;BORDEADORA TRAPP TURBO MASTER 1800W C/ RUEDAS;TRAPP;BORDEADORAS;JARDIN;398.717;
etl.bascs.impala.clases.Producto@a38f7c;125;EDPFJ1009;TR38;7896260201294;20;CABO PROLONGADOR TRAPPPARA LINEA ROJA-FJ 1009;TRAPP;ACCESORIOS JARDIN;JARDIN;12.735;
etl.bascs.impala.clases.Producto@ee9bf9;126;EDXCDGMININ-N;MX76;3016661143748;50;CAFETERA DOLCE GUSTO MOULINEX MOD MINI ME NEGRA + ADAPTADOR;MOULINEX;CAFETERAS;PEQUEÑOS ELECTRODOMESTICOS;985.034;
etl.bascs.impala.clases.Producto@1880b3c;127;EDMXCDGMINIR-N;MX109;3016661143755;50;CAFETERA DOLCE GUSTO MOULINEX MOD MINI ME ROJA + ADAPTADOR;MOULINEX;CAFETERAS;PEQUEÑOS ELECTRODOMESTICOS;985.034;
etl.bascs.impala.clases.Producto@1037680;128;EDKCEAXP341-N;K6;010942216636;50;CAFETERA KRUPS CALVI XP341 ESPRESSO COMPACTA 1450 W 1L CORTE AUTOMATICO;KRUPS;CAFETERAS;PEQUEÑOS ELECTRODOMESTICOS;1.225.899;
etl.bascs.impala.clases.Producto@181d0b3;129;EDXCDGPXSB-N;MX107;3016661155680;50;CAFETERA MOULINEX DG PICCOLO XS BLANCA;MOULINEX;CAFETERAS;PEQUEÑOS ELECTRODOMESTICOS;765.006;
etl.bascs.impala.clases.Producto@120a869;130;EDXCDGPXSN-N;MX105;3016661155703;50;CAFETERA MOULINEX DG PICCOLO XS NEGRA.;MOULINEX;CAFETERAS;PEQUEÑOS ELECTRODOMESTICOS;765.006;
etl.bascs.impala.clases.Producto@569ada;131;EDXCDGPXSR-N;MX106;3016661155697;50;CAFETERA MOULINEX DG PICCOLO XS ROJA;MOULINEX;CAFETERAS;PEQUEÑOS ELECTRODOMESTICOS;765.006;
etl.bascs.impala.clases.Producto@7347a6;132;EDXCFG381A10-N;MX97;3045386380091;50;CAFETERA MOULINEX MOD FG381A10 SOLEIL;MOULINEX;CAFETERAS;PEQUEÑOS ELECTRODOMESTICOS;357.110;
etl.bascs.impala.clases.Producto@1aa0593;133;EDTBCSINGLE;T2603;7841175014743;50;CAFETERA PERSONAL TOKYO SINGLE C/TAZA ACERO INOX INCLUIDA 350W;TOKYO;CAFETERAS;PEQUEÑOS ELECTRODOMESTICOS;79.529;
etl.bascs.impala.clases.Producto@18f936f;134;EDACFPF-N;A501;3016661155765;50;CAFETERA PREFERITA INOX ARNO CAP. 18 TAZAS 550W;ARNO;CAFETERAS;PEQUEÑOS ELECTRODOMESTICOS;268.067;
etl.bascs.impala.clases.Producto@15f444e;135;EDTCCTIME-N;T2067;7896443132988;50;CAFETERA TOKYO MOD CAFE TIME 900W C/FILTRO PERMANENTE LED DIG. TIMER PROGRAMABLE;TOKYO;CAFETERAS;PEQUEÑOS ELECTRODOMESTICOS;340.025;
